{
  "artifacts": [
    "cursor/CURSOR_UNO_R3_PHYSICAL_INTEGRATION_HANDOFF_V0_1_7.md"
  ],
  "commands": [
    {
      "argv": [
        "/opt/pyvenv/bin/python",
        "scripts/validate_cursor_handoff_v017.py"
      ],
      "duration_s": 0.592,
      "evidence_class": "runtime_execution_pass",
      "exit_code": 0,
      "finished_at": "2026-07-24T04:27:57Z",
      "started_at": "2026-07-24T04:27:56Z",
      "stderr": "",
      "stdout": "{\n  \"handoff\": \"cursor/CURSOR_UNO_R3_PHYSICAL_INTEGRATION_HANDOFF_V0_1_7.md\",\n  \"missing_markers\": [],\n  \"status\": \"PASS\",\n  \"version\": \"0.1.7\"\n}\n"
    }
  ],
  "evidence_class": "runtime_execution_pass",
  "finished_at": "2026-07-24T04:27:57Z",
  "next_stage": null,
  "non_claims": [
    "Physical UNO R3, HX711, load-cell, and native Windows execution are not proven by this stage."
  ],
  "receipt_id": "release-v0.1.7-bg-100_cursor_handoff",
  "run_id": "release-v0.1.7-bg",
  "stage_id": "100_cursor_handoff",
  "started_at": "2026-07-24T04:27:56Z",
  "status": "PASS",
  "version": "0.1.7",
  "warnings": []
}
