{
  "artifacts": [],
  "commands": [
    {
      "argv": [
        "/opt/pyvenv/bin/python",
        "-m",
        "pytest",
        "-q",
        "-p",
        "no:cacheprovider",
        "tests/test_storage_crash_safety_v013.py",
        "tests/test_run_management_v013.py"
      ],
      "duration_s": 1.916,
      "evidence_class": "runtime_execution_pass",
      "exit_code": 0,
      "finished_at": "2026-07-24T04:27:51Z",
      "started_at": "2026-07-24T04:27:50Z",
      "stderr": "",
      "stdout": ".............................                                            [100%]\n"
    }
  ],
  "evidence_class": "runtime_execution_pass",
  "finished_at": "2026-07-24T04:27:51Z",
  "next_stage": "80_windows_source_validation",
  "non_claims": [
    "Physical UNO R3, HX711, load-cell, and native Windows execution are not proven by this stage."
  ],
  "receipt_id": "release-v0.1.7-bg-70_recovery_validation",
  "run_id": "release-v0.1.7-bg",
  "stage_id": "70_recovery_validation",
  "started_at": "2026-07-24T04:27:50Z",
  "status": "PASS",
  "version": "0.1.7",
  "warnings": []
}
